{
  "schemaVersion": 1,
  "id": "msv-eleme-five-step-live-run-v2",
  "title": "Mini Silicon Valley｜饿了么｜五步创业闭环 LIVE RUN SCRIPT",
  "course": {
    "id": "eleme-2008-find-problem",
    "name": "饿了么｜五步创业闭环",
    "period": "2008—2009",
    "coverage": "完整课程 · 5 步 / 13 块",
    "description": "从 2008 年宿舍订餐麻烦出发，完成问题、方案、MVP、市场、运营与六分钟 Demo Day。",
    "learnerName": "2008 宿舍订餐创业小队",
    "scriptId": "msv-eleme-five-step-live-run-v2",
    "macroStepCount": 5,
    "blockCount": 13,
    "completeFiveStep": true
  },
  "case": {
    "campaignId": "eleme-2008-find-problem",
    "name": "饿了么：2008 宿舍订餐五步创业战役",
    "learnerName": "2008 宿舍订餐创业小队",
    "period": "2008—2009",
    "why": "第 1 步由教学团队史料驱动；第 2—5 步让学员在 2008 年约束下走完方案、MVP、市场和运营的玩家平行世界，全程与史实明确分层。"
  },
  "sources": [
    {
      "id": "src-eleme-sjtu-youth-origin",
      "title": "青年报：从交大宿舍出发的创业故事",
      "organization": "上海交通大学青年网",
      "url": "https://youth.sjtu.edu.cn/index_news/1446.html",
      "kind": "university",
      "accessed": "2026-09-01"
    },
    {
      "id": "src-eleme-sjtu-mba-origin",
      "title": "安泰 MBA 校友创业故事：张旭豪与饿了么",
      "organization": "上海交通大学安泰经济与管理学院",
      "url": "https://mba.sjtu.edu.cn/news/forums/15315.html",
      "kind": "university",
      "accessed": "2026-09-01"
    },
    {
      "id": "src-eleme-sjtu-youth-process",
      "title": "从电话订餐到网络平台的早期实践",
      "organization": "上海交通大学青年网",
      "url": "https://youth.sjtu.edu.cn/qc_hlzb/3249.html",
      "kind": "university",
      "accessed": "2026-09-01"
    },
    {
      "id": "src-eleme-sjtu-news-2018",
      "title": "交大学子创新创业案例：饿了么",
      "organization": "上海交通大学新闻网",
      "url": "https://news.sjtu.edu.cn/zhxw/20180405/25919.html",
      "kind": "university",
      "accessed": "2026-09-01"
    }
  ],
  "decks": [
    {
      "id": "eleme-2008-find-problem-find-information",
      "macroStepId": "find",
      "drawAtBlockId": "B01",
      "cardsPerLearner": 3,
      "uniqueDeal": true,
      "shuffle": true,
      "cards": [
        {
          "id": "e08-f-01",
          "boundary": "F",
          "title": "F-01 · 2008 年开始尝试餐饮外送",
          "body": "历史事实：上海交通大学公开资料记载，张旭豪等人在 2008 年开始餐饮外送业务与相关创业实践。",
          "sharePrompt": "说清这条事实能证明“有人开始行动”，但不能证明所有学生都有同样需求。",
          "sourceIds": [
            "src-eleme-sjtu-youth-origin",
            "src-eleme-sjtu-news-2018"
          ],
          "credibility": "high"
        },
        {
          "id": "e08-f-02",
          "boundary": "F",
          "title": "F-02 · 电话和餐厅信息是早期入口",
          "body": "历史事实：交大公开叙事描述了团队走访餐厅、整理订餐信息，并用电话处理早期订餐。它不能自动证明每家餐厅流程相同。",
          "sharePrompt": "把“电话订餐”拆成至少三个动作，再指出哪一步还缺真实用户记录。",
          "sourceIds": [
            "src-eleme-sjtu-youth-process"
          ],
          "credibility": "high"
        },
        {
          "id": "e08-r-01",
          "boundary": "R",
          "title": "R-01 · 手里只有几张旧菜单",
          "body": "课堂模拟：一名学生晚上想订餐，桌上只有几张不同餐厅的旧菜单；不知道信息是否还有效。",
          "sharePrompt": "先声明这是模拟场景，再说要找什么真人或记录才能把它变成事实证据。",
          "sourceIds": [],
          "credibility": "medium"
        },
        {
          "id": "e08-r-02",
          "boundary": "R",
          "title": "R-02 · 今晚营业和配送范围未知",
          "body": "课堂模拟：学生不知道餐厅今晚是否营业、是否愿意送到这栋宿舍，只能逐个确认。",
          "sharePrompt": "演出一次逐个确认的过程，指出时间损失发生在哪一步。",
          "sourceIds": [],
          "credibility": "medium"
        },
        {
          "id": "e08-r-03",
          "boundary": "R",
          "title": "R-03 · 餐厅同时顾堂食和电话",
          "body": "课堂模拟：餐厅工作人员一边处理堂食，一边接电话、听菜名、记宿舍地址。",
          "sharePrompt": "列出一次可能的错漏，但不要把“可能”说成已经发生。",
          "sourceIds": [],
          "credibility": "medium"
        },
        {
          "id": "e08-r-04",
          "boundary": "R",
          "title": "R-04 · 多张订单需要排路线",
          "body": "课堂模拟：配送者同时拿到多个地址和时间要求，需要决定先送哪一单。",
          "sharePrompt": "说明配送者的任务与学生的任务哪里不同；不要把三方问题混成一句话。",
          "sourceIds": [],
          "credibility": "medium"
        },
        {
          "id": "e08-c-01",
          "boundary": "F",
          "title": "C-01 · 早期不是先做网站",
          "body": "历史行动：公开资料把 2008 年的早期实践放在网站正式启动之前。团队先做线下订餐与配送，不可倒推为“一开始已有成熟平台”。",
          "sharePrompt": "说出它证明团队先观察了哪些动作，又不能证明哪种产品一定正确。",
          "sourceIds": [
            "src-eleme-sjtu-mba-origin",
            "src-eleme-sjtu-news-2018"
          ],
          "credibility": "high"
        },
        {
          "id": "e08-c-02",
          "boundary": "F",
          "title": "C-02 · 先整理餐厅信息",
          "body": "历史行动：公开叙事描述团队走访餐厅、记录订餐信息，并印发材料帮助学生找到入口。",
          "sharePrompt": "分别说它能证明“信息有人用行动整理”，以及不能证明“所有信息都准确”。",
          "sourceIds": [
            "src-eleme-sjtu-youth-process"
          ],
          "credibility": "high"
        },
        {
          "id": "e08-c-03",
          "boundary": "F",
          "title": "C-03 · 设置统一联系电话",
          "body": "历史行动：公开叙事记载团队设置宿舍订餐电话，由人员接单并调度。",
          "sharePrompt": "指出统一电话减少了哪一步来回，也指出它可能新增哪一步人工压力。",
          "sourceIds": [
            "src-eleme-sjtu-youth-process"
          ],
          "credibility": "high"
        },
        {
          "id": "e08-c-04",
          "boundary": "F",
          "title": "C-04 · 人工接单并组织配送",
          "body": "历史行动：早期流程需要人工接听、记录和调度配送。这是完整任务链的行动证据，不是规模化能力证明。",
          "sharePrompt": "画出接电话到送达的动作链，再圈出最容易漏信息的一步。",
          "sourceIds": [
            "src-eleme-sjtu-youth-process"
          ],
          "credibility": "high"
        },
        {
          "id": "e08-c-05",
          "boundary": "F",
          "title": "C-05 · 创始成员亲自送餐",
          "body": "历史行动：交大公开资料记载创始团队早期亲自参与送餐。它能帮助观察流程，不能证明这种方式可以无限扩大。",
          "sharePrompt": "说出亲自送餐能看到的一条证据，以及它无法回答的一项规模问题。",
          "sourceIds": [
            "src-eleme-sjtu-youth-origin",
            "src-eleme-sjtu-news-2018"
          ],
          "credibility": "high"
        },
        {
          "id": "e08-c-06",
          "boundary": "F",
          "title": "C-06 · 网站在 2009 年正式启动",
          "body": "历史事实：上海交大安泰学院公开资料把饿了么网站正式启动放在 2009 年；不能把这一结果提前当作 2008 年的已知答案。",
          "sharePrompt": "解释为什么知道后来有网站，也不能让团队跳过 2008 年的问题调查。",
          "sourceIds": [
            "src-eleme-sjtu-mba-origin"
          ],
          "credibility": "high"
        }
      ]
    },
    {
      "id": "eleme-2008-find-problem-decide-information",
      "macroStepId": "decide",
      "drawAtBlockId": "B04",
      "cardsPerLearner": 3,
      "uniqueDeal": true,
      "shuffle": true,
      "cards": [
        {
          "id": "e08-decide-f01",
          "boundary": "F",
          "title": "F · 网站是在后面才出现的",
          "body": "公开资料把正式网站启动放在 2009 年。2008 年做选择时，团队还不能把成熟网站当成现成答案。",
          "sharePrompt": "告诉队友：这条事实限制了什么，但没有替我们选方案。",
          "sourceIds": [
            "src-eleme-sjtu-mba-origin"
          ]
        },
        {
          "id": "e08-decide-f02",
          "boundary": "F",
          "title": "F · 早期用统一电话接单",
          "body": "公开叙事记载，团队设置订餐电话，由人接听、记录并安排配送。",
          "sharePrompt": "画出统一电话少掉的一步，以及新增加的一步人工工作。",
          "sourceIds": [
            "src-eleme-sjtu-youth-process"
          ]
        },
        {
          "id": "e08-decide-f03",
          "boundary": "F",
          "title": "F · 先走访餐厅再整理信息",
          "body": "公开资料描述了走访餐厅和整理订餐信息的行动，说明信息收集发生在复杂平台之前。",
          "sharePrompt": "说出这条行动能支持哪条方案，又不能保证什么结果。",
          "sourceIds": [
            "src-eleme-sjtu-youth-process"
          ]
        },
        {
          "id": "e08-decide-r01",
          "boundary": "R",
          "title": "R · 桌上只有 10 枚资源币",
          "body": "课堂模拟：做一个入口花 3 枚币，完成一次下单动作花 4 枚币，给出结果回执花 3 枚币；其他功能现在买不起。",
          "sharePrompt": "用 10 枚币保住一单必须经过的三件事。",
          "sourceIds": []
        },
        {
          "id": "e08-decide-r02",
          "boundary": "R",
          "title": "R · 只服务一位宿舍同学",
          "body": "课堂模拟：今晚只测试一名住在东区宿舍、想点晚饭的同学，不做全校平台。",
          "sharePrompt": "把“大平台”改写成这名同学可以完成的一次动作。",
          "sourceIds": []
        },
        {
          "id": "e08-decide-r03",
          "boundary": "R",
          "title": "R · 餐厅听漏了楼栋",
          "body": "课堂模拟：电话里菜名听清了，但楼栋和房间号只记到一半。",
          "sharePrompt": "比较纸菜单、统一电话和简单网页，哪条路更早暴露这个问题。",
          "sourceIds": []
        },
        {
          "id": "e08-decide-g01",
          "boundary": "G",
          "title": "G · 简单网页也许能减少查菜单",
          "body": "团队推测：把几家餐厅和菜品放到一个简单页面，可能减少学生来回翻菜单的时间。",
          "sharePrompt": "先说“这是我们猜的”，再设计一个能让猜测失败的小测试。",
          "sourceIds": []
        },
        {
          "id": "e08-decide-g02",
          "boundary": "G",
          "title": "G · 统一电话也许只是转移麻烦",
          "body": "团队推测：一个号码方便学生，却可能把大量确认工作压给接线的人。",
          "sharePrompt": "说清谁少做了什么、谁又多做了什么。",
          "sourceIds": []
        },
        {
          "id": "e08-decide-g03",
          "boundary": "G",
          "title": "G · 纸菜单可能是最快的第一版",
          "body": "团队推测：一张更新过的菜单也许比做网页更快得到第一次真实反馈。",
          "sharePrompt": "提出一个今晚就能比较纸菜单和网页的办法。",
          "sourceIds": []
        },
        {
          "id": "e08-decide-u01",
          "boundary": "U",
          "title": "U · 旧菜单到底多常见",
          "body": "当前未知：我们还没有真实记录说明学生碰到旧菜单的频率。",
          "sharePrompt": "说出要问几个人、记录什么，才能继续判断。",
          "sourceIds": []
        },
        {
          "id": "e08-decide-u02",
          "boundary": "U",
          "title": "U · 学生愿不愿意付配送费",
          "body": "当前未知：没有证据说明这名学生愿意为省事支付多少钱。",
          "sharePrompt": "设计一个不诱导回答的价格问题。",
          "sourceIds": []
        },
        {
          "id": "e08-decide-u03",
          "boundary": "U",
          "title": "U · 餐厅愿意怎样更新信息",
          "body": "当前未知：餐厅愿不愿意每天告诉我们售罄和营业变化，还没有被问过。",
          "sharePrompt": "说出要找哪位餐厅工作人员问哪一个具体问题。",
          "sourceIds": []
        }
      ]
    },
    {
      "id": "eleme-2008-find-problem-build-information",
      "macroStepId": "build",
      "drawAtBlockId": "B06",
      "cardsPerLearner": 3,
      "uniqueDeal": true,
      "shuffle": true,
      "cards": [
        {
          "id": "e08-build-f01",
          "boundary": "F",
          "title": "F · 早期流程靠人接听和记录",
          "body": "公开资料描述了电话接单和人工安排。这说明第一版可以先跑通动作，不等自动化系统齐全。",